<?xml version="1.0" encoding="UTF-8" standalone="no" ?>
	<ROOT xmlns:xsi="http://www.w3.org/2001/XMLSchema-instance" xsi:noNamespaceSchemaLocation="ConfigurationInfo.xsd">
		<CONFIGURATION Name="DQMHistosConsumerConfiguration">
			<VIEW Name="DQM_HISTOS_CONSUMER_CONFIGURATION" Type="File,Database,DatabaseTest" Description="No%20description.">
				<COLUMN Type="UID" 	 Name="ProcessorID" 	 StorageName="PROCESSOR_ID" 		DataType="VARCHAR2" 		DataChoices=""/>
				<COLUMN Type="YesNo" 	 Name="SaveDQMFile" 	 StorageName="SAVE_DQM_FILE" 		DataType="VARCHAR2" 		DataChoices=""/>
				<COLUMN Type="Data" 	 Name="DQMFilePath" 	 StorageName="DQM_FILE_PATH" 		DataType="VARCHAR2" 		DataChoices=""/>
				<COLUMN Type="Data" 	 Name="DQMFileNamePrefix" 	 StorageName="DQM_FILE_NAME_PREFIX" 		DataType="VARCHAR2" 		DataChoices=""/>
				<COLUMN Type="Comment" 	 Name="CommentDescription" 	 StorageName="COMMENT_DESCRIPTION" 		DataType="VARCHAR2" 		DataChoices=""/>
				<COLUMN Type="Author" 	 Name="Author" 	 StorageName="AUTHOR" 		DataType="VARCHAR2" 		DataChoices=""/>
				<COLUMN Type="Timestamp" 	 Name="RecordInsertionTime" 	 StorageName="RECORD_INSERTION_TIME" 		DataType="TIMESTAMP WITH TIMEZONE" 		DataChoices=""/>
			</VIEW>
		</CONFIGURATION>
	</ROOT>
