<?xml version="1.0" encoding="UTF-8" standalone="no" ?>
	<ROOT xmlns:xsi="http://www.w3.org/2001/XMLSchema-instance" xsi:noNamespaceSchemaLocation="ConfigurationInfo.xsd">
		<CONFIGURATION Name="VersionAliasesConfiguration">
			<VIEW Name="VERSION_ALIASES_CONFIGURATION" Type="File,Database,DatabaseTest">
				<COLUMN Type="UID" 	 Name="VersionAliasUID" 	 StorageName="VERSION_ALIAS_UID" 		DataType="VARCHAR2"/>
				<COLUMN Type="Data" 	 Name="ConfigurationName" 	 StorageName="CONFIGURATION_NAME" 		DataType="VARCHAR2"/>
				<COLUMN Type="Data" 	 Name="VersionAlias" 	 StorageName="VERSION_ALIAS" 		DataType="VARCHAR2"/>
				<COLUMN Type="Data" 	 Name="Version" 	 StorageName="VERSION" 		DataType="VARCHAR2"/>
				<COLUMN Type="Comment" 	 Name="CommentDescription" 	 StorageName="COMMENT_DESCRIPTION" 		DataType="VARCHAR2"/>
				<COLUMN Type="Author" 	 Name="Author" 	 StorageName="AUTHOR" 		DataType="VARCHAR2"/>
				<COLUMN Type="Timestamp" 	 Name="RecordInsertionTime" 	 StorageName="RECORD_INSERTION_TIME" 		DataType="TIMESTAMP WITH TIMEZONE"/>
			</VIEW>
		</CONFIGURATION>
	</ROOT>
