<?xml version="1.0" encoding="UTF-8" standalone="no" ?>
	<ROOT xmlns:xsi="http://www.w3.org/2001/XMLSchema-instance" xsi:noNamespaceSchemaLocation="ConfigurationInfo.xsd">
		<CONFIGURATION Name="Mu2eGlobalsConfiguration">
			<VIEW Name="MU2E_GLOBALS_CONFIGURATION" Type="File,Database,DatabaseTest" Description="No%20description.">
				<COLUMN Type="UID" 	 Name="UID" 	 StorageName="UID" 		DataType="VARCHAR2" 		DataChoices=""/>
				<COLUMN Type="Data" 	 Name="NumberOfLoopbacks" 	 StorageName="NUMBER_OF_LOOPBACKS" 		DataType="NUMBER" 		DataChoices=""/>
				<COLUMN Type="Data" 	 Name="NumberOfCAPTANPulses" 	 StorageName="NUMBER_OF_CAPTAN_PULSES" 		DataType="NUMBER" 		DataChoices=""/>
				<COLUMN Type="Comment" 	 Name="CommentDescription" 	 StorageName="COMMENT_DESCRIPTION" 		DataType="VARCHAR2" 		DataChoices=""/>
				<COLUMN Type="Author" 	 Name="Author" 	 StorageName="AUTHOR" 		DataType="VARCHAR2" 		DataChoices=""/>
				<COLUMN Type="Timestamp" 	 Name="RecordInsertionTime" 	 StorageName="RECORD_INSERTION_TIME" 		DataType="TIMESTAMP WITH TIMEZONE" 		DataChoices=""/>
			</VIEW>
		</CONFIGURATION>
	</ROOT>
