<?xml version="1.0" encoding="UTF-8" standalone="no" ?>
	<ROOT xmlns:xsi="http://www.w3.org/2001/XMLSchema-instance" xsi:noNamespaceSchemaLocation="ConfigurationInfo.xsd">
		<CONFIGURATION Name="IterationCommandConfigureAliasConfiguration">
			<VIEW Name="ITERATION_COMMAND_CONFIGURE_ALIAS_CONFIGURATION" Type="File,Database,DatabaseTest" Description="No%20description.">
				<COLUMN Type="UID" 	 Name="CommandID" 	 StorageName="COMMAND_ID" 		DataType="VARCHAR2" 		DataChoices=""/>
				<COLUMN Type="Data" 	 Name="SystemAlias" 	 StorageName="SYSTEM_ALIAS" 		DataType="VARCHAR2" 		DataChoices=""/>
				<COLUMN Type="Comment" 	 Name="CommentDescription" 	 StorageName="COMMENT_DESCRIPTION" 		DataType="VARCHAR2" 		DataChoices=""/>
				<COLUMN Type="Author" 	 Name="Author" 	 StorageName="AUTHOR" 		DataType="VARCHAR2" 		DataChoices=""/>
				<COLUMN Type="Timestamp" 	 Name="RecordInsertionTime" 	 StorageName="RECORD_INSERTION_TIME" 		DataType="TIMESTAMP WITH TIMEZONE" 		DataChoices=""/>
			</VIEW>
		</CONFIGURATION>
	</ROOT>
