<?xml version="1.0" encoding="UTF-8" standalone="no" ?>
	<ROOT xmlns:xsi="http://www.w3.org/2001/XMLSchema-instance" xsi:noNamespaceSchemaLocation="ConfigurationInfo.xsd">
		<CONFIGURATION Name="FESupervisorConfiguration">
			<VIEW Name="FE_SUPERVISOR_CONFIGURATION" Type="File,Database,DatabaseTest">
				<COLUMN Type="UID" 	 Name="SupervisorUID" 	 StorageName="SUPERVISOR_UID" 		DataType="VARCHAR2"/>
				<COLUMN Type="ChildLink-0" 	 Name="LinkToFEInterfaceConfiguration" 	 StorageName="LINK_TO_FE_INTERFACE_CONFIGURATION" 		DataType="VARCHAR2"/>
				<COLUMN Type="ChildLinkGroupID-0" 	 Name="LinkToFEInterfaceGroupID" 	 StorageName="LINK_TO_FE_INTERFACE_GROUP_ID" 		DataType="VARCHAR2"/>
				<COLUMN Type="Comment" 	 Name="CommentDescription" 	 StorageName="COMMENT_DESCRIPTION" 		DataType="VARCHAR2"/>
				<COLUMN Type="Author" 	 Name="Author" 	 StorageName="AUTHOR" 		DataType="VARCHAR2"/>
				<COLUMN Type="Timestamp" 	 Name="RecordInsertionTime" 	 StorageName="RECORD_INSERTION_TIME" 		DataType="TIMESTAMP WITH TIMEZONE"/>
			</VIEW>
		</CONFIGURATION>
	</ROOT>
