<?xml version="1.0" encoding="UTF-8" standalone="no" ?>
        <ROOT xmlns:xsi="http://www.w3.org/2001/XMLSchema-instance" xsi:noNamespaceSchemaLocation="ConfigurationInfo.xsd">
                <CONFIGURATION Name="IterationCommandExecuteFEMacroConfiguration">
                        <VIEW Name="ITERATION_COMMAND_EXECUTE_FE_MACRO_CONFIGURATION" Type="File,Database,DatabaseTest" Description="No%20description.">
                                <COLUMN Type="UID"          Name="CommandID"          StorageName="COMMAND_ID"                 DataType="VARCHAR2"                 DataChoices=""/>
                                <COLUMN Type="ChildLink-targets"          Name="LinkToTargets"          StorageName="LINK_TO_TARGETS"                 DataType="VARCHAR2"                 DataChoices="arbitraryBool=0,IterationTargetConfiguration"/>
                                <COLUMN Type="ChildLinkGroupID-targets"          Name="LinkToTargetsGroupID"          StorageName="LINK_TO_TARGETS_GROUP_ID"                 DataType="VARCHAR2"                 DataChoices=""/>
                                <COLUMN Type="Data"          Name="MacroName"          StorageName="MACRO_NAME"                 DataType="VARCHAR2"                 DataChoices=""/>
                                <COLUMN Type="ChildLink-macroDimensionalLoops"          Name="LinkToMacroDimensionalLoopTable"          StorageName="LINK_TO_MACRO_DIMENSIONAL_LOOP_TABLE"                 DataType="VARCHAR2"                 DataChoices="arbitraryBool=0,NO_LINK,IterationCommandMacroDimensionalLoopConfiguration"/>
                                <COLUMN Type="ChildLinkGroupID-macroDimensionalLoops"          Name="LinkToMacroDimensionalLoopGroupID"          StorageName="LINK_TO_MACRO_DIMENSIONAL_LOOP_GROUP_ID"                 DataType="VARCHAR2"                 DataChoices=""/>
                                <COLUMN Type="YesNo"          Name="EnableSavingOutputsToFile"          StorageName="ENABLE_SAVING_OUTPUTS_TO_FILE"                 DataType="VARCHAR2"                 DataChoices=""/>
                                <COLUMN Type="Data"          Name="OutputFilePath"          StorageName="OUTPUT_FILE_PATH"                 DataType="VARCHAR2"                 DataChoices=""/>
                                <COLUMN Type="Data"          Name="OutputFileRadix"          StorageName="OUTPUT_FILE_RADIX"                 DataType="VARCHAR2"                 DataChoices=""/>
                                <COLUMN Type="Comment"          Name="CommentDescription"          StorageName="COMMENT_DESCRIPTION"                 DataType="VARCHAR2"                 DataChoices=""/>
                                <COLUMN Type="Author"          Name="Author"          StorageName="AUTHOR"                 DataType="VARCHAR2"                 DataChoices=""/>
                                <COLUMN Type="Timestamp"          Name="RecordInsertionTime"          StorageName="RECORD_INSERTION_TIME"                 DataType="TIMESTAMP WITH TIMEZONE"                 DataChoices=""/>
                        </VIEW>
                </CONFIGURATION>
        </ROOT>