<?xml version="1.0" encoding="UTF-8" standalone="no" ?>
	<ROOT xmlns:xsi="http://www.w3.org/2001/XMLSchema-instance" xsi:noNamespaceSchemaLocation="ConfigurationInfo.xsd">
		<CONFIGURATION Name="IterationCommandModifyGroupConfiguration">
			<VIEW Name="ITERATION_COMMAND_MODIFY_GROUP_CONFIGURATION" Type="File,Database,DatabaseTest" Description="'DoTrackGroupChanges'%20-%20when%20true%2C%20will%20save%20modifications%20that%20are%20configured%20in%20a%20new%20group.%20When%20false%2C%20modificaitons%20will%20be%20saved%20to%20a%20temporary%20group%20and%20will%20not%20be%20saved%20as%20new%20group%20keys%20and%20table%20versions%20in%20the%20configuration%20database.">
				<COLUMN Type="UID" 	 Name="CommandID" 	 StorageName="COMMAND_ID" 		DataType="VARCHAR2" 		DataChoices=""/>
				<COLUMN Type="ChildLink-targets" 	 Name="LinkToTargets" 	 StorageName="LINK_TO_TARGETS" 		DataType="VARCHAR2" 		DataChoices="arbitraryBool=0,IterationTargetConfiguration"/>
				<COLUMN Type="ChildLinkGroupID-targets" 	 Name="LinkToTargetsGroupID" 	 StorageName="LINK_TO_TARGETS_GROUP_ID" 		DataType="VARCHAR2" 		DataChoices=""/>
				<COLUMN Type="TrueFalse" 	 Name="DoTrackGroupChanges" 	 StorageName="DO_TRACK_GROUP_CHANGES" 		DataType="VARCHAR2" 		DataChoices=""/>
				<COLUMN Type="Data" 	 Name="RelativePathToField" 	 StorageName="RELATIVE_PATH_TO_FIELD" 		DataType="VARCHAR2" 		DataChoices=""/>
				<COLUMN Type="Data" 	 Name="FieldStartValue" 	 StorageName="FIELD_START_VALUE" 		DataType="NUMBER" 		DataChoices=""/>
				<COLUMN Type="Data" 	 Name="FieldIterationStepSize" 	 StorageName="FIELD_ITERATION_STEP_SIZE" 		DataType="NUMBER" 		DataChoices=""/>
				<COLUMN Type="Comment" 	 Name="CommentDescription" 	 StorageName="COMMENT_DESCRIPTION" 		DataType="VARCHAR2" 		DataChoices=""/>
				<COLUMN Type="Author" 	 Name="Author" 	 StorageName="AUTHOR" 		DataType="VARCHAR2" 		DataChoices=""/>
				<COLUMN Type="Timestamp" 	 Name="RecordInsertionTime" 	 StorageName="RECORD_INSERTION_TIME" 		DataType="TIMESTAMP WITH TIMEZONE" 		DataChoices=""/>
			</VIEW>
		</CONFIGURATION>
	</ROOT>
